### ISSUE TITLE
vStream client asking for "current" VGTID position does not receive it until a change event 

### ISSUE THREAD

**Issue by aquarapid** [vitessio/vitess#6391]
I have written a test vStream client here: 

https://github.com/aquarapid/vitess_examples

It will take various parameters for a vtgate gRPC endpoint, keyspace and VGTID on the commandline, and then print out vStream events as it receives them.

Running this against the unsharded `commerce` keyspace from the Vitess `examples/local`:

```
$ go run vstream_test_client_debug.go -vtgate=localhost:15991 -keyspace=commerce -tablet_type=replica -pos='[ {"shard":"0", "gtid":"current"} ]'
vtgate connecting to: localhost:15991
vgtid: shard_gtids:<keyspace:"commerce" shard:"0" gtid:"current" > 
tablet_type: REPLICA

```

Note that it does not actually receive any events.  If I modify a table in the commerce keyspace, I will start to receive events.  However, vStream is supposed to send a position event when a client connects using the "current" specifier in the VGTID.  This does not seem to happen.  Looking at the code, and the relevant vttablet logfile, I can see:

```
I0628 00:48:34.414069   48234 uvstreamer.go:353] Stream() called
I0628 00:48:34.415970   48234 uvstreamer.go:289] sendEventsForCurrentPos
I0628 00:48:34.416101   48234 vstreamer.go:146] Starting Stream() with startPos MySQL56/b828186e-b8ee-11ea-9073-001e677affd5:1-30
I0628 00:48:34.417420   48234 slave_connection.go:72] new slave connection: slaveID=577343558
I0628 00:48:34.417440   48234 slave_connection.go:117] sending binlog dump command: startPos=b828186e-b8ee-11ea-9073-001e677affd5:1-30, slaveID=577343558
```

this indicates that `sendEventsForCurrentPos()` was called, but as can be seen from the client, no events was received.  This can be confirmed by a tcpdump of the gRPC port of the above connection:

```
$ sudo tcpdump -s0 -i lo port 15991 -A
dropped privs to tcpdump
tcpdump: verbose output suppressed, use -v or -vv for full protocol decode
listening on lo, link-type EN10MB (Ethernet), capture size 262144 bytes
00:48:34.412216 IP localhost.49072 > localhost.15991: Flags [S], seq 276901767, win 65495, options [mss 65495,sackOK,TS val 1241086072 ecr 0,nop,wscale 7], length 0
E..<<>@.@..|..........>w../..........0.........
I.xx........
00:48:34.412262 IP localhost.15991 > localhost.49072: Flags [S.], seq 3519185525, ack 276901768, win 65483, options [mss 65495,sackOK,TS val 1241086072 ecr 1241086072,nop,wscale 7], length 0
E..<..@.@.<.........>w.....u../......0.........
I.xxI.xx....
00:48:34.412281 IP localhost.49072 > localhost.15991: Flags [.], ack 1, win 512, options [nop,nop,TS val 1241086072 ecr 1241086072], length 0
E..4<?@.@.............>w../....v.....(.....
I.xxI.xx
00:48:34.412472 IP localhost.49072 > localhost.15991: Flags [P.], seq 1:25, ack 1, win 512, options [nop,nop,TS val 1241086072 ecr 1241086072], length 24
E..L<@@.@..j..........>w../....v.....@.....
I.xxI.xxPRI * HTTP/2.0

SM


00:48:34.412486 IP localhost.15991 > localhost.49072: Flags [.], ack 25, win 512, options [nop,nop,TS val 1241086072 ecr 1241086072], length 0
E..4..@.@...........>w.....v../......(.....
I.xxI.xx
00:48:34.412527 IP localhost.49072 > localhost.15991: Flags [P.], seq 25:34, ack 1, win 512, options [nop,nop,TS val 1241086072 ecr 1241086072], length 9
E..=<A@.@..x..........>w../....v.....1.....
I.xxI.xx.........
00:48:34.412536 IP localhost.15991 > localhost.49072: Flags [.], ack 34, win 512, options [nop,nop,TS val 1241086072 ecr 1241086072], length 0
E..4..@.@...........>w.....v../......(.....
I.xxI.xx
00:48:34.412738 IP localhost.15991 > localhost.49072: Flags [P.], seq 1:16, ack 34, win 512, options [nop,nop,TS val 1241086072 ecr 1241086072], length 15
E..C..@.@...........>w.....v../......7.....
I.xxI.xx.............@.
00:48:34.412760 IP localhost.49072 > localhost.15991: Flags [.], ack 16, win 512, options [nop,nop,TS val 1241086072 ecr 1241086072], length 0
E..4<B@.@.............>w../..........(.....
I.xxI.xx
00:48:34.412862 IP localhost.15991 > localhost.49072: Flags [P.], seq 16:25, ack 34, win 512, options [nop,nop,TS val 1241086073 ecr 1241086072], length 9
E..=..@.@...........>w......../......1.....
I.xyI.xx.........
00:48:34.412869 IP localhost.49072 > localhost.15991: Flags [P.], seq 34:43, ack 16, win 512, options [nop,nop,TS val 1241086073 ecr 1241086072], length 9
E..=<C@.@..v..........>w../..........1.....
I.xyI.xx.........
00:48:34.412895 IP localhost.15991 > localhost.49072: Flags [.], ack 43, win 512, options [nop,nop,TS val 1241086073 ecr 1241086073], length 0
E..4..@.@...........>w......../......(.....
I.xyI.xy
00:48:34.412913 IP localhost.49072 > localhost.15991: Flags [.], ack 25, win 512, options [nop,nop,TS val 1241086073 ecr 1241086073], length 0
E..4<D@.@..~..........>w../..........(.....
I.xyI.xy
00:48:34.413007 IP localhost.49072 > localhost.15991: Flags [P.], seq 43:126, ack 25, win 512, options [nop,nop,TS val 1241086073 ecr 1241086073], length 83
E...<E@.@..*..........>w../..........{.....
I.xyI.xy..J........E.c.f.J....*.L...q..
:.A......	...|?_..u.b.&=LMedz......`+...@.te.M.5...
00:48:34.413028 IP localhost.15991 > localhost.49072: Flags [.], ack 126, win 512, options [nop,nop,TS val 1241086073 ecr 1241086073], length 0
E..4..@.@...........>w........0......(.....
I.xyI.xy
00:48:34.413043 IP localhost.49072 > localhost.15991: Flags [P.], seq 126:168, ack 25, win 512, options [nop,nop,TS val 1241086073 ecr 1241086073], length 42
E..^<F@.@..R..........>w..0..........R.....
I.xyI.xy..!...............
.
.commerce..0..current
00:48:34.413049 IP localhost.15991 > localhost.49072: Flags [.], ack 168, win 512, options [nop,nop,TS val 1241086073 ecr 1241086073], length 0
E..4..@.@...........>w........0/.....(.....
I.xyI.xy
00:48:34.413359 IP localhost.15991 > localhost.49072: Flags [P.], seq 25:55, ack 168, win 512, options [nop,nop,TS val 1241086073 ecr 1241086073], length 30
E..R..@.@...........>w........0/.....F.....
I.xyI.xy............!.............	...
00:48:34.413379 IP localhost.49072 > localhost.15991: Flags [.], ack 55, win 512, options [nop,nop,TS val 1241086073 ecr 1241086073], length 0
E..4<G@.@..{..........>w..0/.........(.....
I.xyI.xy
00:48:34.413533 IP localhost.49072 > localhost.15991: Flags [P.], seq 168:185, ack 55, win 512, options [nop,nop,TS val 1241086073 ecr 1241086073], length 17
E..E<H@.@..i..........>w..0/.........9.....
I.xyI.xy.............	...
00:48:34.413563 IP localhost.15991 > localhost.49072: Flags [.], ack 185, win 512, options [nop,nop,TS val 1241086073 ecr 1241086073], length 0
E..4..@.@...........>w........0@.....(.....
I.xyI.xy
00:48:38.775715 IP localhost.49072 > localhost.15991: Flags [F.], seq 185, ack 55, win 512, options [nop,nop,TS val 1241090435 ecr 1241086073], length 0
E..4<I@.@..y..........>w..0@.........(.....
I...I.xy
00:48:38.775893 IP localhost.15991 > localhost.49072: Flags [F.], seq 55, ack 186, win 512, options [nop,nop,TS val 1241090436 ecr 1241090435], length 0
E..4..@.@...........>w........0A.....(.....
I...I...
00:48:38.775945 IP localhost.49072 > localhost.15991: Flags [.], ack 56, win 512, options [nop,nop,TS val 1241090436 ecr 1241090436], length 0
E..4<J@.@..x..........>w..0A.........(.....
I...I...
```

The keyspace (`commerce`), shard (`0`) and gtid (`current`) values can be seen sent from the client to vtgate, but no concrete position is returned to the client;  as we would expect.

This is a problem, because until the vStream client sees a concrete position for each shard, if it loses connection it has to reconnect using `"current"`;  which means it could lose events during the period it is not connected.
